{
  "schemaVersion": 1,
  "artifactType": "advisor-assessment-plan",
  "generatedAt": "2026-09-18T00:00:00Z",
  "expiresAt": "2026-09-18T00:30:00Z",
  "planId": "advisor-plan-fixture-0001",
  "planSha256": "4bd1ba518bbf766cf00e379de967857bf49f6fc32ecc72b4e298878658f454cc",
  "projectRoot": "C:/fixture/project",
  "request": {"requestId": "advisor-request-fixture-0001"},
  "requestRef": {"path": "C:/fixture/request.json", "fileSha256": "aaaaaaaaaaaaaaaaaaaaaaaaaaaaaaaaaaaaaaaaaaaaaaaaaaaaaaaaaaaaaaaa", "artifactSha256": "bbbbbbbbbbbbbbbbbbbbbbbbbbbbbbbbbbbbbbbbbbbbbbbbbbbbbbbbbbbbbbbb"},
  "identities": {"profileId": "profile-0123456789abcdef", "property": "properties/123", "webStream": "properties/123/dataStreams/456", "site": "sc-domain:example.test", "verifiedOrigin": "https://example.test"},
  "periods": [{"label": "current", "from": "2026-08-01", "to": "2026-08-28", "complete": true}, {"label": "previous", "from": "2026-07-04", "to": "2026-07-31", "complete": true}],
  "steps": [{"stepId": "baseline", "state": "planned", "reason": "planned"}, {"stepId": "ga4", "state": "planned", "reason": "planned"}, {"stepId": "search-console", "state": "planned", "reason": "planned"}, {"stepId": "cross-source", "state": "planned", "reason": "planned"}, {"stepId": "synthesis", "state": "planned", "reason": "planned"}],
  "domains": [
    {"domainId": "resource-and-period", "state": "checked", "reason": "fixed"},
    {"domainId": "business-goal-and-outcomes", "state": "not_checked", "reason": "pending"},
    {"domainId": "tag-and-gtm-route", "state": "not_checked", "reason": "pending"},
    {"domainId": "consent-and-coverage", "state": "not_checked", "reason": "pending"},
    {"domainId": "overview", "state": "not_checked", "reason": "pending"},
    {"domainId": "acquisition", "state": "not_checked", "reason": "pending"},
    {"domainId": "landing-and-content", "state": "not_checked", "reason": "pending"},
    {"domainId": "device-and-geo", "state": "not_checked", "reason": "pending"},
    {"domainId": "events-and-key-events", "state": "not_checked", "reason": "pending"},
    {"domainId": "ecommerce", "state": "not_applicable", "reason": "not enabled"},
    {"domainId": "search-console-performance", "state": "not_checked", "reason": "pending"},
    {"domainId": "cross-source-context", "state": "not_checked", "reason": "pending"},
    {"domainId": "data-quality-and-quota", "state": "not_checked", "reason": "pending"},
    {"domainId": "unanswered-business-questions", "state": "not_checked", "reason": "pending"}
  ],
  "budget": {"execution": "sequential"},
  "resumeFrom": null,
  "blockers": [],
  "limitations": [],
  "planningNetworkUsed": true,
  "mutationPerformed": false
}
